{
  "$schema": "https://therahulagarwal.com/rahul-resume/assets/json/rahul-resume-schema.json",
  "firstName": "Rahul",
  "middleName": "",
  "lastName": "Agarwal",
  "preset": "deedy-inspired-open-fonts",
  "showLastUpdated": true,
  "links": [
    {
      "text": "therahulagarwal.com",
      "href": "https://therahulagarwal.com/"
    },
    {
      "text": "github.com/ragarwalll",
      "href": "https://github.com/ragarwalll"
    }
  ],
  "resume": {
    "sections": [
      {
        "heading": "experience",
        "column": 1,
        "subsections": [
          {
            "heading": "SAP Labs India",
            "info": {
              "title": "Full Stack Developer",
              "sameLine": true
            },
            "metadata": {
              "duration": "Present - 2019",
              "location": "Bengaluru, India"
            },
            "content": {
              "type": "list",
              "items": [
                {
                  "segments": [
                    {
                      "text": "Built and scaled a multi-tenant provisioning system using"
                    },
                    {
                      "text": "Kubernetes Operators, CRDs & ArgoCD for GitOps",
                      "style": {
                        "bold": true
                      }
                    },
                    {
                      "text": "cutting down customer setup time by 90% and supporting 100+ enterprise deployments."
                    }
                  ]
                },
                {
                  "segments": [
                    {
                      "text": "Architected and developed a"
                    },
                    {
                      "text": "Go Lang",
                      "style": {
                        "bold": true
                      }
                    },
                    {
                      "text": "based content management system for SAP BTP, implementing"
                    },
                    {
                      "text": "directed acyclic graph",
                      "style": {
                        "bold": true
                      }
                    },
                    {
                      "text": "for dependency resolution and cloud-native deployment using custom buildpacks, evolving from internal prototype to open-source solution with 15+ enterprise adoptions."
                    }
                  ]
                },
                {
                  "segments": [
                    {
                      "text": "Developed a content management SaaS solution using"
                    },
                    {
                      "text": "SAPUI5, JavaScript, XML & MVC",
                      "style": {
                        "bold": true
                      }
                    },
                    {
                      "text": "pattern for SAP BTP, implementing innovative"
                    },
                    {
                      "text": "event bus architecture",
                      "style": {
                        "italic": true
                      }
                    },
                    {
                      "text": "for real-time data synchronization, driving adoption across 50+ enterprise customers.i"
                    }
                  ]
                },
                {
                  "segments": [
                    {
                      "text": "Built a"
                    },
                    {
                      "text": "VS Code extension",
                      "href": "https://marketplace.visualstudio.com/items?itemName=ragarwal06.create-sap-fs-app-vsix",
                      "style": {
                        "bold": true,
                        "underline": true
                      }
                    },
                    {
                      "text": "to automate project onboarding, reducing setup time by 60% and boosting productivity for 1,500+ developers across product teams"
                    }
                  ]
                },
                {
                  "segments": [
                    {
                      "text": "Developed Book LLM, an"
                    },
                    {
                      "text": "AI-powered",
                      "style": {
                        "bold": true
                      }
                    },
                    {
                      "text": "document analysis tool leveraging"
                    },
                    {
                      "text": "LangChain",
                      "style": {
                        "bold": true
                      }
                    },
                    {
                      "text": "framework and multiple"
                    },
                    {
                      "text": "LLMs,",
                      "style": {
                        "bold": true
                      }
                    },
                    {
                      "text": "enabling flexible document processing (JSON, PDF, CSV) through intuitive UI and developer API for custom implementations."
                    }
                  ]
                },
                {
                  "segments": [
                    {
                      "text": "Built Yellow Circle, a mental health platform initiative by Human Resource's Office using"
                    },
                    {
                      "text": "UI5, Node.js, and TypeScript",
                      "style": {
                        "bold": true
                      }
                    },
                    {
                      "text": "driving adoption among 1,000+ employees and fostering workplace well-being through secure, confidential support resources."
                    }
                  ]
                },
                {
                  "segments": [
                    {
                      "text": "Led architecture and development of Care for Life platform using"
                    },
                    {
                      "text": "Turborepo monorepo design and React.js,",
                      "style": {
                        "bold": true
                      }
                    },
                    {
                      "text": "implementing dynamic role-based system for benevolent fund management, guiding 10-member team."
                    }
                  ]
                },
                {
                  "segments": [
                    {
                      "text": "Developed an end-to-end scholar onboarding system using"
                    },
                    {
                      "text": "Node.js and TypeScript",
                      "style": {
                        "bold": true
                      }
                    },
                    {
                      "text": "featuring built-in social platform and chat functionality, processing 150+ new graduates annually while cutting onboarding time from days to hours."
                    }
                  ]
                },
                {
                  "segments": [
                    {
                      "text": "Designed and developed an employee rewards platform for Managing Director's office using"
                    },
                    {
                      "text": "Node.js and TypeScript,",
                      "style": {
                        "bold": true
                      }
                    },
                    {
                      "text": "managing 5,000+ nominations from 10,000+ employees, featuring automated multi-tier jury review system and end-to-end selection workflow."
                    }
                  ]
                }
              ]
            }
          }
        ]
      },
      {
        "heading": "Personal Projects",
        "column": 1,
        "content": {
          "type": "list",
          "items": [
            {
              "segments": [
                {
                  "text": "Built"
                },
                {
                  "text": "VitaGen,",
                  "href": "https://therahulagarwal.com/rahul-resume",
                  "style": {
                    "underline": true
                  }
                },
                {
                  "text": "an open-source resume generator that transforms JSON data using"
                },
                {
                  "text": "Python",
                  "style": {
                    "bold": true
                  }
                },
                {
                  "text": "into"
                },
                {
                  "text": "LaTeX",
                  "style": {
                    "bold": true
                  }
                },
                {
                  "text": "documents, featuring GitHub-based PDF generation through issues/PRs and extensive customization options for colors, typography, and layouts."
                }
              ]
            },
            {
              "segments": [
                {
                  "text": "Built a social networking platform for"
                },
                {
                  "text": "Rotaract Club of Kolkata,",
                  "href": "https://github.com/ragarwalll/rotaractheritage",
                  "style": {
                    "underline": true
                  }
                },
                {
                  "text": "single-handedly using"
                },
                {
                  "text": "PHP and JavaScript,",
                  "style": {
                    "bold": true
                  }
                },
                {
                  "text": "implementing core features including posts, real-time chat, and member networking capabilities."
                }
              ]
            }
          ]
        }
      },